{"artifact":{"cachePath":"sources\\4d4b315c85cf10df\\sample_lichess_small.pgn","mediaType":"application/x-chess-pgn","sha256":"712e82a8194a308c58a0042df84819b85c36b3489dc9543aee33818e5711cf1e","sizeBytes":652},"createdAt":"2024-01-01T12:00:00","provenance":{"platform":"windows-amd64","pythonVersion":"3.12.10","toolVersion":"0.1.0"},"schemaVersion":"v1","source":{"uri":"C:\\coding\\renacechess\\tests\\data\\sample_lichess_small.pgn"}}